{
  "$schema": "https://json-schema.org/draft/2020-12/schema",
  "type": "object",
  "required": [
    "id",
    "question",
    "answer",
    "category"
  ],
  "properties": {
    "id": {
      "type": "string"
    },
    "question": {
      "type": "string"
    },
    "answer": {
      "type": "string"
    },
    "category": {
      "type": "string"
    }
  }
}
